<?xml version="1.0" encoding="UTF-8"?>
<DenormalizedDdi xmlns="http://dda.dk/ddi/denormalized-ddi"
 xmlns:xsi="http://www.w3.org/2001/XMLSchema-instance"
 xsi:schemaLocation="http://dda.dk/ddi/denormalized-ddi file:/C:/Users/kp/Dropbox/DDA/DDA-IPF/schema/denormalization/denormalized-ddi.xsd">
    <ConceptList>
        <Concept id="id1" studyId="studyId1">
            <ConceptReference id="id3"/>
            <ConceptReference id="id5"/>
            <VariableReference id="id7"/>
        </Concept>
        <Concept id="id9" studyId="studyId3">
            <VariableReference id="id11"/>
            <MultipleQuestionItemReference id="id13"/>
            <VariableReference id="id15"/>
        </Concept>
        <Concept id="id17" studyId="studyId5">
            <UniverseReference id="id19"/>
            <UniverseReference id="id21"/>
            <CategoryReference id="id23"/>
        </Concept>
    </ConceptList>
    <QuestionItemList>
        <QuestionItem id="id25" studyId="studyId7">
            <VariableReference id="id27"/>
            <MultipleQuestionItemReference id="id29"/>
            <QuestionItemReference id="id31"/>
        </QuestionItem>
        <QuestionItem id="id33" studyId="studyId9">
            <QuestionItemReference id="id35"/>
            <MultipleQuestionItemReference id="id37"/>
            <CategoryReference id="id39"/>
        </QuestionItem>
        <QuestionItem id="id41" studyId="studyId11">
            <MultipleQuestionItemReference id="id43"/>
            <ConceptReference id="id45"/>
            <MultipleQuestionItemReference id="id47"/>
        </QuestionItem>
    </QuestionItemList>
    <ConceptList>
        <Concept id="id49" studyId="studyId13">
            <MultipleQuestionItemReference id="id51"/>
            <MultipleQuestionItemReference id="id53"/>
            <ConceptReference id="id55"/>
        </Concept>
        <Concept id="id57" studyId="studyId15">
            <QuestionItemReference id="id59"/>
            <MultipleQuestionItemReference id="id61"/>
            <ConceptReference id="id63"/>
        </Concept>
        <Concept id="id65" studyId="studyId17">
            <UniverseReference id="id67"/>
            <ConceptReference id="id69"/>
            <ConceptReference id="id71"/>
        </Concept>
    </ConceptList>
</DenormalizedDdi>
